UserTags,time,Tweets
Barack Obama,2024-05-28T18:17:42.000Z,"When Brian Wallach was diagnosed with ALS, he was given six months to live. 
@bsw5020
 and 
@sabrevaya
’s film, For Love & Life: No Ordinary Campaign, chronicles their incredible journey, and proves that all of us are far more powerful than we know. I hope you’ll watch it on Prime"
Barack Obama,2024-05-27T21:04:57.000Z,"Bill Walton was one of the greatest basketball players of all time – a champion at every level and the embodiment of unselfish team play. He was also a wonderful spirit full of curiosity, humor and kindness. We are poorer for his passing, and Michelle and I send our deepest"
Barack Obama,2024-04-09T04:01:08.000Z,"Congrats to the back-to-back national champs, 
@UConnMBB
! Great season by an incredibly impressive team."
Barack Obama,2024-04-07T21:20:24.000Z,"Congrats to 
@GamecockWBB
 and Coach 
@DawnStaley
 on a perfect season and their third title! It's been an incredible year for women's basketball, and this team was so disciplined and talented. Well deserved."
Barack Obama,2024-03-31T14:00:24.000Z,"From our family to yours, we hope you have a wonderful and blessed Easter!"
Barack Obama,2024-03-30T19:30:06.000Z,"From record-breaking job growth to expanding health care coverage, 
@JoeBiden
 has spent each and every day working on behalf of the American people. I can’t say the same about the guy running against him."
Barack Obama,2024-03-28T18:30:18.000Z,This is important work being led by President Biden and Vice President Harris. We can drive innovation while also creating the right safeguards and oversight of artificial intelligence.
Barack Obama,2024-03-27T23:20:39.000Z,"Joe Lieberman and I didn’t always see eye-to-eye, but he had an extraordinary career in public service, including four decades spent fighting for the people of Connecticut. He also worked hard to repeal “Don’t Ask Don’t Tell” and helped us pass the Affordable Care Act. In both"
Barack Obama,2024-03-26T21:49:39.000Z,"In your early 20s? You might not know that the Affordable Care Act is the reason you can stay on your parents’ health care plan until you’re 26. Before the ACA, health care companies could kick you off earlier – sometimes right after college.

It’s another reason why we need to"
Barack Obama,2024-03-19T12:00:47.000Z,"My picks are in! I sat down to talk about them with 
@CraigMalRob
 and 
@UKCoachCalipari
 on their podcast Ways To Win from 
@HGMedia
. Check out our conversation wherever you get your podcasts. And please don’t rub it in when my bracket gets busted. http://apple.co/waystowin"
Barack Obama,2024-03-08T23:04:36.000Z,"It’s always great checking in on the progress at the Obama Presidential Center. Yesterday, I had a chance to see a preview of the ‘Power of Words’ exhibit. 

When it opens, Michelle and I hope the Center will be a place where visitors from Chicago and beyond will come to reflect"
Barack Obama,2024-03-08T20:15:19.000Z,"This is who we need leading the country for the next four years. Congrats to 
@POTUS
 on a powerful State of the Union address last night."
Joe Biden,2024-03-05T13:21:05.000Z,"If you’re in a Super Tuesday state or territory, polls are starting to open.

Now is the time to make your voice heard.

Confirm your polling place at http://IWillVote.com."
Barack Obama,2024-02-27T15:04:06.000Z,"Ten years ago today we launched the 
@MBK_Alliance
 to build safe communities and expand opportunities for boys and young men of color. I'm so proud of the work that more than 100 MBK communities across the country are doing, and can’t wait to see what they accomplish over the next"
Barack Obama,2024-02-23T18:52:25.000Z,"Wisconsin made history this week! 
@GovEvers
 signed into law new, competitive state legislative maps that get rid of one of the most gerrymandered maps in the country. Wisconsinites will now have a real shot at electing leaders who are responsive to the will of the people."
Barack Obama,2024-01-15T15:01:44.000Z,"Dr. King’s commitment to equality and justice inspired generations to fight for civil rights. His words continue to resonate around the world, and #MLKDay serves as a reminder to all of us to keep building on his legacy. If you can, take a moment today to think about how you can"
Barack Obama,2024-01-10T22:13:23.000Z,"Thanks to 
@POTUS
' leadership, Obamacare is once again setting new records for enrollment. If you're looking for quality, affordable health coverage, you can still enroll now at http://HealthCare.gov."
Barack Obama,2023-12-29T15:00:46.000Z,Here are some of my favorite songs from this year. Let me know if there are any artists or songs I should check out.
Barack Obama,2023-12-27T21:00:43.000Z,"Earlier this year, writers and actors went on strike to advocate for better working conditions and protections. It led to important changes that will transform the industry for the better.

Here are some films that reflect their hard work over the last year — including some like"
Barack Obama,2023-12-28T23:35:40.000Z,Update: I just saw The Color Purple and loved it. I'm adding it to this list as one of my favorite movies of the year.
Barack Obama,2023-12-25T15:10:53.000Z,"This year has tested us in many ways, but Christmas is a reminder of the power of community to keep us together even in difficult times. Wishing you all a peaceful holiday."
Barack Obama,2023-12-22T18:00:49.000Z,"As I usually do during this time of year, I wanted to share my favorite books, movies, and music of 2023.

First up, here are the books I've enjoyed reading. If you’re looking for a new book over the holidays, give one of them a try. And if you can, shop at an independent"
Barack Obama,2023-11-09T17:04:38.000Z,I recently went on the Decoder Podcast to talk about how the Biden-Harris Administration is working to take advantage of the opportunities and minimize the risks of artificial intelligence—and the ways the next generation of AI professionals can help shape the future. Listen now
Barack Obama,2023-11-08T22:21:26.000Z,"Yesterday, voters across the country turned out for the values we’re fighting for – because they know state and local elections matter."
Barack Obama,2023-11-08T22:21:27.000Z,"In Virginia — where every single seat in the General Assembly was on the ballot — voters gave Democrats the majority in both the Senate and House of Delegates, preventing Republicans from passing a radical conservative agenda."
Barack Obama,2023-11-08T22:21:28.000Z,"I’m also proud of all the Obama-Biden alumni running for office. Last night, 
@GabeAmo
 became Rhode Island’s first Black representative, and 
@PhilforVirginia
 joined Virginia's House of Delegates. 

As we head into 2024, let’s keep organizing, keep voting, and keep making our"
Barack Obama,2023-11-07T17:46:30.000Z,"This Election Day, progress is on the ballot. Make sure to vote today—find your polling location at http://IWillVote.com, then reach out to your friends, family, and everyone you know and remind them to vote, too."
Barack Obama,2023-11-06T18:36:27.000Z,"Progress in Virginia is at stake in this election—and there's no time to waste. Every single seat in the Virginia General Assembly will be on the ballot tomorrow, November 7th, so make a plan to vote and find your polling place at http://IWillVote.com/VA."
Barack Obama,2023-11-05T14:47:26.000Z,"For eight years, 
@POTUS
 and I worked to deliver change for the American people. I couldn’t have asked for a better Vice President and friend — and we’ll always be thankful to all the campaign staff and Administration alumni who helped bring that progress to folks across the"
Michelle Obama,2023-11-04T21:30:03.000Z,"To all our Obama alumni who joined Barack and me in Chicago, as well as all those who couldn’t make it, I just want to say thank you for everything you have done over the past 15 years—not just for me, not just for Barack, but for our country and our world."
Barack Obama,2023-11-04T20:36:04.000Z,"15 years ago today, I asked you to believe in the change we could create together—and you did. I’m so proud of our Obama alumni, many of whom we saw this week, for carrying that mission forward."
Barack Obama,2023-10-26T21:33:46.000Z,"There are important elections happening right now in states across the country. This Vote Early Day, make sure you're registered to vote at http://IWillVote.com, vote early if you can, or make a plan to vote on Election Day, November 7th."
Barack Obama,2023-10-23T18:38:18.000Z,I wanted to share some thoughts on what’s happening right now in Israel and Gaza.
Barack Obama,2023-10-23T18:38:19.000Z,"""A Timeline of Israel and Palestine’s Complicated History"" by Nicole Narea"
Barack Obama,2023-10-23T18:38:19.000Z,"""Gaza: The Cost of Escalation"" by Ben Rhodes"
Barack Obama,2023-10-19T20:31:49.000Z,"Ohio, there’s an important election happening right now. 

If you want to protect abortion rights by making them part of your state Constitution, vote yes on Issue 1. 

Visit http://ohiodems.org/yeson1 and make your plan to vote before November 7th."
Barack Obama,2023-10-19T20:31:49.000Z,"And if you’re looking for ways to get involved, join the 
@OHDems
 and make calls to remind folks to vote:"
Barack Obama,2023-10-19T02:34:16.000Z,"Congrats to our back-to-back champs, 
@LVAces
!"
Barack Obama,2023-09-20T16:02:21.000Z,"The 
@MBK_Alliance
 recently awarded grants to 33 organizations in Chicago that are working to lift up and empower young boys and men of color. They’ve been doing some inspiring work.

Take a look at what they’ve been up to this summer:"
Barack Obama,2023-09-19T19:48:06.000Z,"Great news — starting today, Pennsylvania will begin automatic voter registration for folks getting a driver's license or state ID card at the DMV. Hopefully even more states will follow."
Barack Obama,2023-09-19T16:50:43.000Z,"If you want your representatives to support the issues you care about, it’s important to show up to vote in every election.

This National Voter Registration Day, register or update your voter registration at http://IWillVote.com. Then ask your family and friends to do the"
Barack Obama,2023-09-16T14:23:00.000Z,"Fourteen years ago, when the big three automakers were struggling to stay afloat, my administration and the American people stepped in to support them. So did the auto workers in the UAW who sacrificed pay and benefits to help get the companies back on their feet. Now that our"
The Obama Foundation,2023-09-15T22:09:32.000Z,"To everyone celebrating the start of Rosh Hashanah tonight, Shanah Tovah!

: President 
@BarackObama
 greets Elie Wiesel and guests during the Jewish American History Month reception at the White House in 2011."
Barack Obama,2023-09-15T14:41:07.000Z,"If you’re looking to help people impacted by the floods in Libya, check out these organizations providing relief:"
The Obama Foundation,2023-09-14T19:56:13.000Z,"The devastating impact of the earthquake that struck Morocco on Sept. 8 is gut-wrenching. We join the international community in mourning the lives lost, and thanking the people who have answered the call to provide humanitarian relief. 

We've gathered ways you can help below "
Barack Obama,2023-08-22T14:48:59.000Z,"Through the Voyager Scholarship, Michelle, 
@BChesky
, and I are supporting the next generation of leaders pursuing careers in public service.

We're excited to welcome our newest class of Voyagers, and can’t wait to work with them over the next few years. http://obama.org/programs/voyager-scholarship/2023-2025/…"
Barack Obama,2023-08-20T14:15:36.000Z,"Congrats to Spain on their first 
@FIFAWWC
 victory! The U.S. will be back next time."
Barack Obama,2023-08-16T21:47:29.000Z,"It’s now been one year since 
@POTUS
 signed the Inflation Reduction Act into law—lowering health care costs for families and investing in our future by accelerating the transition to clean energy."
Barack Obama,2023-08-16T21:49:14.000Z,"This matters. The heatwaves in the Southwest, the floods in the Northeast, and the devastating wildfires we’ve seen across the country and in my home state of Hawai’i are all reminders that the climate crisis is here. By 2030, the Inflation Reduction Act could help cut carbon"
Barack Obama,2023-08-16T21:49:14.000Z,Joe Biden and Kamala Harris are working every day to deliver a better future and grow the middle class—and the Inflation Reduction Act is an example of the groundbreaking investments they’ve made since taking office. Here’s to another historic year.
Barack Obama,2023-08-16T21:49:13.000Z,"The Inflation Reduction Act is also helping drive a boom in American clean energy manufacturing. Businesses have announced more than 270 new clean energy projects in the last year alone—creating more than 170,000 jobs in 44 states. And more local investments are being announced"
Barack Obama,2023-08-15T18:36:52.000Z,"If you’re looking for more ways to support folks in Lāhainā and on Maui, I hope you’ll consider donating to these local organizations that are providing direct support on the ground: https://obama.org/discover/stories/take-action-hawaii-fires…"
Barack Obama,2023-08-15T00:49:40.000Z,It will take all of us coming together and doing what we can to help those in need in Maui and Lāhainā right now. I hope you’ll join me in donating to the Hawai'i Red Cross today: http://redcross.org/donate/cm/khon2-pub.html…
Barack Obama,2023-08-14T21:48:34.000Z,Michelle and I will always be grateful for Clarence’s friendship and wise counsel. Our thoughts are with his family and everyone whose life was touched by a truly remarkable man.
Barack Obama,2023-08-14T16:02:12.000Z,"With temperatures breaking records around the world this summer, the problem of global warming can seem overwhelming. Here’s a reminder that progress is possible—and it’s critical to vote for those who support bold action to advance a clean energy future."
